text,label
Thank you for your exceptional teamwork,1
Your proactive engagement has enhanced our team dynamics,1
I would like to request additional resources,1
 Let's evaluate if this project is doable.,0
Thank you for your continued support,1
Could you handle the client onboarding process,1
 Check out the report I sent.,0
 Make sure all the gear is working right.,0
 Can you help revise the budget?,0
Mind if I check this out?,0
We need to address this issue immediately,1
 Can you finish the training docs for the workshop?,0
Your leadership has inspired the entire team,1
We must ensure all team members are informed of the changes,1
 It’s awesome how you always strive to get better!,0
 Can you help with following up with the clients?,0
 Thanks for being an awesome team player!,0
Please review the client's feedback and respond accordingly,1
 Make sure all the safety stuff is set up.,0
 Stick to the ethical rules for the project.,0
We are updating our internal policies,1
 Sorry for the mix-up before.,0
We must comply with all regulatory requirements,1
Could you manage the upcoming event,1
 You're doing an awesome job!,0
 Make sure all the data is logged correctly.,0
 Let me know as soon as you can.,0
 Sorry for telling you this last minute.,0
Your positive attitude has a significant impact on the team,1
I have completed my assignment.,1
I apologize for the delay in response,1
 We're beefing up our cyber defenses to keep data safe!,0
 Sync up with IT if you need tech help.,0
We need to streamline our communication channels,1
Please review the updated meeting minutes and provide feedback,1
Your professionalism is highly regarded,1
 Check out the new meeting notes and let me know what you think.,0
We are enhancing our digital infrastructure,1
 Let’s tackle the client’s worries to keep them happy.,0
Could you assist with the data analysis,1
 Can you finish the slides by tomorrow?,0
I apologize for the short notice,1
 Can you help with getting the new hires settled?,0
 Your dedication to excellence is inspiring the whole team!,0
 We're working hard to make things better.,0
We must maintain open lines of communication,1
 We're growing and adding more people to the team!,0
We are launching a new initiative next month,1
 Can you finish the report by Friday?,0
 Your skills have been a huge help!,0
""" Keep this info to yourself, okay?""",0
 You're really good at juggling tasks efficiently!,0
Your leadership has been instrumental in our progress,1
Could you assist with the budget revisions,1
Please coordinate with the IT department for technical support,1
Thank you for your continued dedication,1
Your proactive approach has benefited the entire team,1
 Let's wrap up the contract details.,0
 We're upgrading our training to help everyone out more.,0
We are improving our internal communication channels,1
Nice to meet you!,0
I apologize for any delays in the project timeline,1
We are launching a new initiative to boost employee morale,1
Can you help me out?,0
 Make sure you send the reports correctly and by the deadline.,0
 Can you manage the QA process?,0
 Sorry for the timeline hold-ups.,0
 We're starting a fresh training program next month!,0
We need to finalize the contract terms,1
Please wait a moment.,1
Could you kindly assist me?,1
We are implementing new strategies to enhance productivity,1
I would like to schedule a follow-up meeting,1
 We're dedicated to offering top-notch service!,0
 Can you liaise with the outside partners?,0
Please ensure all safety measures are in place,1
 Let the team know how you’re doing.,0
 You’ve inspired everyone with how you lead!,0
Your initiative has led to significant improvements,1
 Your creative ideas have boosted our projects!,0
Please review the attached report,1
 Stick to the guidelines we agreed on.,0
 We need you to join in!,0
 Your cool ideas are pushing the project ahead!,0
 We’re rolling out new tools to make things run smoother!,0
 Can you take care of the event logistics?,0
 Your input has been crucial for our wins!,0
Could you assist with the client follow-ups,1
We must maintain transparency in all our dealings,1
We must address the client's concerns promptly,1
 Can you get the financial forecasts ready for next quarter?,0
 Make sure everyone follows the safety rules to the letter.,0
 We really value how committed you are to the project!,0
Your leadership during the crisis was commendable,1
 Finish all the tasks before the deadline.,0
Your proactive measures have prevented potential issues,1
 Your creative fixes have really helped our operations!,0
We are launching a feedback system to gather employee opinions,1
 Can you help analyze the market research?,0
We are enhancing our cybersecurity measures to protect data,1
We need to assess the project's feasibility,1
Please submit your feedback by the end of the day,1
I am very sorry for my error.,1
Could you handle the client communications,1
 Thanks for being flexible while we’re switching things up!,0
 We gotta follow all the rules.,0
 Sorry I missed that.,0
Could you prepare the necessary reports,1
I apologize for any inconvenience caused by the delivery delay,1
 Can you help organize the event?,0
 Thanks for always being reliable and performing well!,0
We must address the feedback received,1
Could you draft the initial proposal,1
 We're dedicated to going greener and cutting our footprint!,0
Could you finalize the training materials for the workshop,1
Your ability to adapt to changing circumstances is commendable,1
I apologize for any oversight on my part,1
Your commitment to the project is highly valued,1
 We're upgrading how we communicate internally!,0
We must maintain high standards of quality,1
I would like to discuss your career development,1
 Make sure we review all contracts carefully.,0
Your contributions have been vital to our success,1
Hang on a sec.,0
 Check out the client's feedback and reply as needed.,0
Please ensure all tasks are completed by the deadline,1
Please provide the necessary documents,1
Could you coordinate with the external partners,1
 Sorry for the schedule change trouble.,0
Your creativity has enhanced our projects,1
Thank you for your prompt attention,1
I apologize for any misunderstanding caused by my previous email,1
 Let’s fix these problems to make the project a win.,0
""" You're really professional, which we respect!""",0
We are enhancing our training programs to better support employees,1
 Let's make our work process more efficient.,0
 Can you check out the latest version of the doc?,0
Could you finalize the report by the end of the week,1
 Let’s tackle the client's worries right away.,0
I apologize for the confusion earlier,1
Could you oversee the implementation process,1
 You're really awesome at hitting deadlines!,0
Thank you for your help.,1
Thank you for your flexibility during this transition,1
 You're really dedicated to doing great work!,0
We are committed to providing exceptional value to our clients,1
 Can we talk about your career growth?,0
We need to address the upcoming challenges,1
 We're upgrading our digital systems!,0
It is a pleasure to meet you.,1
 Thanks for staying dedicated!,0
 Thanks for your awesome input on the project!,0
 Let's fix this right now.,0
 Can we talk about the budget distribution?,0
 Sorry for getting back to you late.,0
 Sorry the staffing changes caused trouble.,0
 Can you put together a recap of what we decided in the meeting?,0
 Sorry for the sudden changes causing trouble.,0
We are launching a new marketing campaign,1
I apologize for any misunderstanding,1
 We're dedicated to building a supportive workplace!,0
Could you prepare the meeting minutes,1
 Can we get some more resources?,0
We must adhere to the project's ethical guidelines,1
 Make sure we follow all the standards.,0
We must ensure compliance with all standards,1
 Can you manage the customer satisfaction surveys?,0
I would appreciate your prompt response,1
 Your quick actions stopped some problems from happening!,0
 Sorry if things got mixed up.,0
 Can you handle our social media?,0
Thank you for your meticulous work,1
Could you clarify your last statement,1
 Your good vibes really lift the team's spirits!,0
 What did you mean by that?,0
Could you assist with the market research analysis,1
 Stick to the top quality standards.,0
Please ensure all equipment is functioning properly,1
Thank you for your dedication to continuous improvement,1
Thanks a lot!,0
Hey how's it going?,0
Could you prepare a summary of the meeting outcomes,1
We must address these issues to ensure project success,1
We must address the resource allocation to meet our targets,1
 Thanks for being so thorough with your work!,0
Please update the team on the latest developments,1
Your commitment to excellence sets a great example for the team,1
Could you arrange the necessary meetings,1
 We're dedicated to finishing projects on time!,0
 We're starting a fresh project next month!,0
I would like to discuss the budget allocation,1
 You're really inspiring with how dedicated you are!,0
 Your initiative has helped everyone out!,0
 We're doing a deep dive into this.,0
I regret any inconvenience caused,1
I apologize for any inconvenience caused by the system update,1
 Great job and thanks for all your effort!,0
We must prioritize this task to meet our goals,1
Thank you for your swift action,1
Thank you for your insightful suggestions,1
 Can you take care of the paperwork for the new process?,0
We must adhere to the highest standards of quality,1
 Can you manage getting new clients set up?,0
 We're rolling out new strategies to boost productivity.,0
 Check out the new policy document.,0
 Can you set up the agenda for our next meetup?,0
Sorry about that.,0
 Thanks for handling this quickly!,0
 Thanks for sticking with us!,0
 Your active participation has made the team vibe better!,0
 Thanks for your awesome input!,0
Thank you for your exceptional attention to detail,1
Could you assist with the event coordination,1
Please maintain confidentiality regarding this matter,1
Could you assist with the financial analysis,1
We are committed to fostering a supportive work environment,1
We are committed to fostering a collaborative environment,1
Thank you for your hard work and dedication,1
We are conducting a thorough analysis,1
Could you assist with the performance metrics analysis,1
I apologize for any inconvenience caused by the changes,1
I apologize for any inconvenience caused by the staffing changes,1
Thank you for your dedication to maintaining high standards,1
Could you manage the social media accounts,1
We must adhere to the company policies,1
 Keep everything transparent in how we work.,0
 Can you put together the first draft of the proposal?,0
Your innovative ideas have propelled the project forward,1
Could you provide me with some assistance?,1
Could you assist with the onboarding process,1
 Make sure your messages are clear and to the point.,0
 Let's tackle the feedback we've gotten.,0
My bad.,0
 Can you handle organizing the next event?,0
 Thanks for your smart ideas!,0
We are expanding our operations internationally,1
 Thanks for getting it!,0
Could you review the latest draft of the document,1
 Sorry if I missed something.,0
 Stick to the schedule for the project.,0
Your enthusiasm has boosted team morale,1
Your dedication to the team is inspiring,1
 Can you help me crunch the numbers?,0
Please review the updated policy document,1
 Let's tackle the challenges ahead.,0
Could you finalize the budget proposal,1
 You’re awesome at adapting when things change!,0
Your dedication to continuous improvement is admirable,1
 Make sure everyone on the team knows about the changes.,0
Your expertise has greatly benefited the project,1
Please ensure all reports are submitted accurately and on time,1
Thank you for your thoroughness in completing the tasks,1
Could you verify the accuracy of the data,1
 Can you get the required reports ready?,0
 Thanks for acting so quickly!,0
 Make sure we follow all the safety rules.,0
Could you provide more details?,1
We are launching a new training program next month,1
May I take a look at this document?,1
 Thanks for being so detail-oriented!,0
 Your leadership has really driven our success!,0
 We're kicking off a fresh marketing push!,0
I apologize for the technical difficulties,1
We are striving to achieve our quarterly goals,1
""" Stick to the rules, please.""",0
Your dedication to meeting deadlines is impressive,1
 Sorry the delivery was late and caused trouble.,0
Please update the team on your progress,1
I apologize for the oversight,1
Your reliability ensures smooth operations,1
Your ability to adapt is impressive,1
Could you prepare the agenda for the next meeting,1
 Thanks for keeping up the high standards!,0
 Sorry if my last email confused you.,0
 We're dedicated to giving our clients outstanding value!,0
 Can you help me with the financial breakdown?,0
 Your planning skills have really helped!,0
I apologize for any inconvenience caused by the unexpected changes,1
Thank you for your understanding,1
 Keep the communication channels open.,0
Thank you for your consistent performance and reliability,1
 Sorry for the hassle.,0
I apologize for the inconvenience.,1
 Sorry the changes caused trouble.,0
 We really value how you solve problems!,0
Thank you for your unwavering support,1
Could you prepare the financial projections for next quarter,1
 Make this task top priority to hit our targets.,0
